<?xml version="1.0" encoding="UTF-8"?>
<formatter xmlns:xsi="http://www.w3.org/2001/XMLSchema-instance" 
xsi:noNamespaceSchemaLocation="../fwnScheme.xsd">

		<destino nombre="0" tipoDato="BigDecimal">
			<origen nombre="FIONEGN004" tipoDatoValor="BigDecimal"
				propiedadValor="FIONEG004010"  />
		</destino>
		
		<destino nombre="01" tipoDato="BigDecimal">
			<origen nombre="SECURE_USERID"/>
		</destino>
				
		<destino persist="sucessBuy" tipoDato="BigDecimal">
			<funcion method="FuncionConstante">
				<origen nombre="true" />
			</funcion>
		</destino>
</formatter>