<?xml version="1.0" encoding="UTF-8"?>

<formatter xmlns:xsi="http://www.w3.org/2001/XMLSchema-instance" 
xsi:noNamespaceSchemaLocation="../fwnScheme.xsd">  
  
  <destino nombre="00" tipoDato="BigDecimal">
    <origen nombre="spark_criterio" />
  </destino>
  
   <destino nombre="01" tipoDato="BigDecimal">
    <origen nombre="SECURE_USERID" />
  </destino>
  
  <destino persist="pulsado_top">
    <origen nombre="pulsado_top" />
  </destino>
  
 <destino persist="pulsado_latest">
    <origen nombre="pulsado_latest" />
  </destino>
  
  <destino persist="pulsado_basic">
    <origen nombre="pulsado_basic" />
  </destino>
  
  <destino persist="sucessBuy" tipoDato="BigDecimal">
	<funcion method="FuncionConstante">
		<origen nombre="" />
	</funcion>
  </destino>
  
  <destino persist="errorPaypalSEC" tipoDato="String">
	<funcion method="FuncionConstante">
		<origen nombre="" />
	</funcion>
  </destino>
  
   <destino persist="spark_id" tipoDato="BigDecimal">
	<funcion method="FuncionConstante">
		<origen nombre="" />
	</funcion>
  </destino>
  
  <destino persist="selected_price" tipoDato="BigDecimal">
	<funcion method="FuncionConstante">
		<origen nombre="" />
	</funcion>
  </destino>
  
</formatter>

