<?xml version="1.0" encoding="UTF-8"?>
<formatter xmlns:xsi="http://www.w3.org/2001/XMLSchema-instance" 
xsi:noNamespaceSchemaLocation="../fwnScheme.xsd">

		 <destino nombre="00" tipoDato="BigDecimal">
		 	<origen nombre="spark_id" />
		 </destino>

		 <destino nombre="01" tipoDato="BigDecimal">
		 	<origen nombre="SECURE_USERID" />
		 </destino>

		 <destino persist="sucessBuy" tipoDato="BigDecimal">
		 	<funcion method="FuncionConstante">
		 		<origen nombre="" />
		 	</funcion>
		 </destino>
		<!-- 
		 <destino persist="errorPaypalCBA" tipoDato="BigDecimal">
		 	<funcion method="FuncionConstante">
		 		<origen nombre="true" />
		 	</funcion>
		 </destino>  -->
</formatter>