<?xml version="1.0" encoding="UTF-8"?>

<formatter xmlns:xsi="http://www.w3.org/2001/XMLSchema-instance" 
xsi:noNamespaceSchemaLocation="../fwnScheme.xsd">  

		<destino nombre="00" tipoDato="BigDecimal">
			<origen nombre="spark_id"/>
		</destino>

		<destino nombre="01" tipoDato="String">
			<origen nombre="nombre"/>
		</destino>

		<destino nombre="02" tipoDato="String">
			<origen nombre="descripcion" />
		</destino>
		
		<destino nombre="03" tipoDato="String">
			<origen nombre="version"/>
		</destino>
		
		<destino nombre="04" tipoDato="String">
			<origen nombre="descCorta"/>
		</destino>
		
		<destino nombre="05" tipoDato="String">
			<origen nombre="novedades"/>
		</destino>
		
		<destino nombre="06" tipoDato="String">
			<origen nombre="otrosKeywords" />
		</destino>
		
		<destino nombre="07" tipoDato="String">
			<origen nombre="email"/>
		</destino>
		
		<destino nombre="08"  tipoDato="String">
			<origen nombre="marketingURL"/>
		</destino>
				
		<destino nombre="09" tipoDato="String">
			<origen nombre="esTrial"/>
		</destino>
		
		<destino nombre="10" tipoDato="BigDecimal">
			<origen nombre="diasTrial"/>
		</destino>
		
		<destino nombre="11" tipoDato="String">
			<origen nombre="icono" />
		</destino>
		
		<destino nombre="12" tipoDato="String">
			<origen nombre="banner"/>
		</destino>
		
		<destino nombre="13" tipoDato="String">
			<origen nombre="video"/>
		</destino>
		
		<destino nombre="14" tipoDato="String">
			<origen nombre="idsKeywords"/>
		</destino>
		<!-- 
		<destino nombre="15" tipoDato="BigDecimal">
			<origen nombre="eulaId"/>
		</destino>  -->
		
		<destino nombre="16" tipoDato="String">
			<origen nombre="idTarifa"/>
		</destino>
		
		<destino nombre="17" tipoDato="String">
			<origen nombre="idTarifaProd"/>
		</destino>
		
		<destino nombre="18" tipoDato="String">
			<origen nombre="emailPaypal"/>
		</destino>
	
</formatter>
