<?xml version="1.0" encoding="ISO-8859-1"?>
<formatter 	xmlns:xsi="http://www.w3.org/2001/XMLSchema-instance" 
			xsi:noNamespaceSchemaLocation="../fwnScheme.xsd">

	<destino nombre="USER_ID">
		<origen nombre="SECURE_USERID" />
	</destino>
	<destino nombre="USER_FISTNAME">
		<origen nombre="SECURE_USER_FISTNAME" />
	</destino>
	<destino nombre="USER_SURNAME">
		<origen nombre="SECURE_USER_SURNAME" />
	</destino>
	<destino nombre="USER_MAIL">
		<origen nombre="SECURE_USERMAIL" />
	</destino>
	<destino nombre="USER_MAIL_ID">
		<origen nombre="SECURE_USERMAIL_ID" />
	</destino>
	<destino nombre="CHANGEMYPASSWD">
		<funcion method="FuncionConstante">
			<origen nombre="false" />
		</funcion>
	</destino>
	<destino nombre="USER_PASSWORD">
		<funcion method="FuncionConstante">
			<origen nombre="" />
		</funcion>
	</destino>
	<destino nombre="USER_NEWPASSWORD1">
		<funcion method="FuncionConstante">
			<origen nombre="" />
		</funcion>
	</destino>
	<destino nombre="USER_NEWPASSWORD2">
		<funcion method="FuncionConstante">
			<origen nombre="" />
		</funcion>
	</destino>
	<destino nombre="USER_ENTITY_ID">
		<origen nombre="SECURE_USER_ENTITY_ID" />
	</destino>
	<destino nombre="USER_ENTITY_NAME">
		<origen nombre="SECURE_USER_ENTITY_NAME" />
	</destino>
	<destino nombre="USER_ACCOUNTTYPE_ID">
		<origen nombre="SECURE_USER_ACCOUNTTYPE_ID" />
	</destino>
	<destino nombre="USER_ACCOUNTTYPE_NAME">
		<origen nombre="SECURE_USER_ACCOUNTTYPE_NAME" />
	</destino>
	<destino nombre="USER_STATUS">
		<origen nombre="SECURE_USER_STATUS" />
	</destino>
	<destino nombre="USER_CREDITCARD_NUMBER">
		<origen nombre="SECURE_USER_CREDITCARD_NUMBER" />
	</destino>
	<destino nombre="USER_CREDITCARD_EXPIRATION">
		<origen nombre="SECURE_USER_CREDITCARD_EXPIRATION" />
	</destino>
	<destino nombre="USER_SIGNUPCODE">
		<origen nombre="SECURE_USER_SIGNUPCODE" />
	</destino>
	<destino nombre="USER_NICKNAME">
		<origen nombre="SECURE_USER_NICKNAME" />
	</destino>
	<destino nombre="USER_FULLNAME">
		<origen nombre="SECURE_USER_FULLNAME" />
	</destino>
	<destino nombre="USER_DISPLAYNAME">
		<origen nombre="SECURE_USER_DISPLAYNAME" />
	</destino>
	<destino nombre="USER_AVATARBUILDER_UMD5">
		<origen nombre="SECURE_USERMAILD5" />
	</destino>
	<destino nombre="USER_USERGROUP_ID">
		<origen nombre="SECURE_USER_USERGROUP_ID" />
	</destino>
	<destino nombre="USER_USERGROUP">
		<origen nombre="SECURE_USER_USERGROUP" />
	</destino>
	<destino nombre="USER_TITLE">
		<origen nombre="SECURE_USER_TITLE" />
	</destino>
	<destino nombre="USER_FLAGENTITY">
		<origen nombre="SECURE_USER_FLAG_ENTITY" />
	</destino>
	<destino nombre="USER_BILLING_AGREEMENT_ID">
		<origen nombre="SECURE_USER_BILLING_AGREEMENT_ID" />
	</destino>
	<destino nombre="USER_ACCOUNTTYPE_METHOD">
		<origen nombre="SECURE_USER_ACCOUNTTYPE_METHOD" />
	</destino>
	<destino nombre="account_credit">
		<origen nombre="SECURE_USER_ACCOUNT_CREDIT"></origen>
	</destino>
	<destino nombre="FLAG_CERT">
		<origen nombre="SECURE_FLAG_CERT"></origen>
	</destino>
	<destino nombre="USER_LEGALENTITYNAME">
		<origen nombre="FIONEGN027" propiedadValor="FIONEG027020" tipoDatoValor="String" />
	</destino>
	<destino nombre="USER_ORGANIZATIONTYPE_ID">
		<origen nombre="FIONEGN027" propiedadValor="FIONEG027030" tipoDatoValor="BigDecimal" />
	</destino>
	<destino nombre="USER_WEBSITE">
		<origen nombre="FIONEGN027" propiedadValor="FIONEG027040" tipoDatoValor="String" />
	</destino>
	<destino nombre="USER_WORKEMAIL">
		<origen nombre="FIONEGN027" propiedadValor="FIONEG027050" tipoDatoValor="String" />
	</destino>
	<destino nombre="USER_COUNTRYCODE">
		<origen nombre="FIONEGN027" propiedadValor="FIONEG027060" tipoDatoValor="String" />
	</destino>
	<destino nombre="USER_PHONENUMBER">
		<origen nombre="FIONEGN027" propiedadValor="FIONEG027070" tipoDatoValor="String" />
	</destino>
	<destino nombre="USER_EXT">
		<origen nombre="FIONEGN027" propiedadValor="FIONEG027080" tipoDatoValor="String" />
	</destino>
	

</formatter>